Insult,Date,Comment
1,20120618192155Z,you fuck your dad
0,20120528192215Z,i really do not understand your point xa it seems that you are mixing apples and oranges
0,,a xc xa majority of canadians can and has been wrong before now and will be again n nunless you supportive of the idea that nothing is full proof or perfect so you take your chances and if we should inadvertently kill your son or daughter then them the breaks and we can always regard you as collateral damage like in wartime and sorry but xc xa the cheques in the mail
0,,listen if you dont wanna get married to a man or a women dont do it what would it bother you if gay people got married stay in your lane do you let them do them and your god is so nice but quick to judg if your not like him thought you wasnt suppose to judge people
0,20120619094753Z,c xe c b u ea n xu u ed ng u u b u eddng bi u ec u t xecnh c xf xf n ho xe kh xf ng nc xe c ng u b d xe n ng u ed i cu xed u u ea u chi u ee nh u ee c c xf xf n ho xe kh xf ng <SIGNS> nc xe c n xf ng d xe n gi u eef u u ea t u edf v u n giang c u ea n th u a c xf xf n ho xe kh xf ng <SIGNS> n nr u ed t cu u ed c u u b u ee c g xec xa th xec ch xfang ta u xe bi u ebft <SIGNS> nai c u ng y xeau chu u ed ng ho xe b xecnh nh u b ng u xf i khi ho xe b xecnh ch u ec th u eadt s u ef u u ebfn sau chi u ebfn tranh m xe th xf i nkh xf ng c xf n con u u b u eddng n xe o ch u ecdn kh xe c u xe u u u eebng m u a th xeam n u b xe
0,20120620171226Z,sdl ok but i would hope they sign him to a one year contract to start with give him the chance to be reliable and productive but give themselves the out if all his time off has hurt his playing skills or if he falls back into old habits
0,20120503012628Z,yeah and where are you now <SIGNS>
1,,shut the fuck up you and the rest of your faggot friends should be burned at the stake
1,20120502173553Z,either you are fake or extremely stupid maybe both
1,20120620160512Z,that you are an idiot who understands neither taxation nor women health
0,20120620015140Z,jdstorm dont wish him injury but it happened on its own and i doubt he injured he looked embarrassed to me
0,20120530044519Z,be careful jimbo og has a fork with your name on it
0,,tonnyb or they just do not pay attention
0,,hm perhaps some who are too pig faced to get laid and therefore have zero chance of getting pregnant from such activity hold something against women who can <SIGNS> idk stream of consciousnees thought after looking at her
0,,barrettmarson huh her income was her spending was my math puts that at
1,20120611090207Z,for some reason u sound retarded lol damn where u been negro
1,20120320162532Z,you with the racist screen name n nyou are a pieceofshit
0,,oh <SIGNS> cheating as well cup was a cheat fest you still dare to post that comment shame on you lol
1,20120320075347Z,your such a dickhead
1,20120320203947Z,your a retard go post your head up your
0,20120612051612Z,eephusblue xa makes you want to say mike macwhogal <SIGNS>
0,20120611234235Z,http w youtube com watch <SIGNS> v tlyllphkru
0,20120502215304Z,and you know they burned holes in all the carpeting
0,20120503031721Z,you are a land creature you would drown
0,,to all those doom and gloomers the chicken littles who claim the sky is falling and that society is collapsing canada has had gay marriage nationwide for years where is the disaster where is the collapse and the persecution you shouting about where is it please show us some examples because it starting to look like your threats and fears and warnings are nothing but hot air
0,20120612144331Z,craig we have been saying from the start that this is a very entertaining show xa it awakens the horny little goth in me xa i met my boyfriend during the first season and one of the first thing we did was watch ahs at my house xa i know he likes me and all but to this day he is sure i am far creepier and kinkier than he could ever be xa thanks american horror story xa sweet clam loves you
0,20120529025329Z,strange you are talking about that when there were chelsea fans in here belittling the community shield
0,20120612052926Z,but how would you actually get the key out <SIGNS>
0,20120528193950Z,oh cool some more internet points for your collection <SIGNS>
0,20120529230121Z,even though i think there are better coaches out there i am glad del negro is keeping his job i never thought he got enough credit those years when he took those average chicago bulls teams he coached to the playoffs years in a row
0,20120611201838Z,russellpiano xa nhm how can we spin obama honoring vietnam troops as something negative answer does not matter <SIGNS> look at our followers they ll take anything n n nobama team xa hm how can we make the liberal messiah look better in light of the revelations of his leaking classified information to the new york times <SIGNS> i know lets have a bogus photo shoot at the viet nam memorial that will make obama look like he cares about vets but first we ll have to clear all the vets out of the immediate area because they ca not be trusted
0,20120529115214Z,a good article which for all the good it will do could have been delivered to a brick wall
0,,head up warning another source of funding for media matters is peter lewis of the progessive insurance company you know those auto insurance commercials that run every minutes on cable television featuring the gal who looks like a blow up doll with red lips and xc xa a perfectly round mouth if you know what i mean nif you have progressive xc xa auto insurance just know that part of your premium is going to fund a progressive liberal xc xa organization hell bent xc xa on destroying xc xa our country and our free speech their mission is to xc xa bring down xc xa hannity beck dobbs lavin limbaugh boortz etc we must not let them win
0,20120620055647Z,sdnoriko lol as if capcom listens watch them fuck this up too i hope i am wrong i love okami
1,20120515132156Z,allinit your xa hypocrisy xa is sickening you ignorant loser
0,20120620011710Z,fast furious did not work out like they planned did it <SIGNS> lololololololol
0,20120530111709Z,mitt is not the best candidate for president but going against the worst xa candidate xa ever should help him tremendously xa lol xa n nobama is one and done it could happen no other way
1,20120620161958Z,i ca not believe the stupid people on this site that have no idea what is going on xa you fools xa you are all useful idiots xa they are hiding the truth because you fools who protect him would look like the useful idiots you are
1,20120609163743Z,fucking behave then you prick <SIGNS>
0,20120619094846Z,the only other relevant fact is that he is destroying america <SIGNS>
0,20120609175446Z,you are a liar
1,20120620075045Z,is that it <SIGNS> your sum total to any conversation is first abuse and then calling them a troll you are a typical socialist idiot keep up your non existent class warfare it is as pointless as you
0,20120619231647Z,beanstalk briview welp then nbw right <SIGNS>
0,20120620024445Z,good job fellas i did not quite read the rules about a signature piece but i guess that was as good as any i found some great blogs to follow and to share over at g if i not commenting on your blogs it because i always throw my two cents in when i post my share add me on there if you are a googler nhttps plus google com posts again congratulations to the winners and i hope we get the chance to submit something else this was fucking fun
0,,i say hang is ass in the center of the town to let it be known that this type of behavior gets this type of punishment the lady had a kid week ago women are not safe to have sex after child birth for at least weeks so even if this was xc xa consensual it would have been way too soon and hurt the lady i am so glad the the baby is so young and will not remember this event happening in it house and i hope the mother recovers quickly
1,20120619074710Z,faggot
0,20120529201852Z,you right if you are relaxe then you can give better result or perform and your identity should be from your work
1,20120529130844Z,aimless abe you are a delusion weirdo that should be locked up inside and kept away from computers xa anyone who doubts the lunacy of abe the moronic prog frog from nyc please read this thread and you will see abe completely come apart from the seams and go off the deep end
0,20120610150536Z,that i do not doubt n n as a blackberry clone n nbut your original argument was not that android would have existed just that android somehow predates ios development
0,20120530023429Z,okc should work out a deal to get a pg who plays more like parker or cp i think nash at the point and move westbrook to sg that team would be unstoppable imagine the shots nash would create for durant then westbrook would be at his natural position too the guy does not create shots or distribute
0,20120619183841Z,maher show goes on and on npalin xa alakda show gets canceled n nis not the free market wonderful <SIGNS>
1,20120320131007Z,even as a troll you are a pathetic failure
0,20120529231612Z,grazie mille sabrina <SIGNS> sei cos xec dolce n nbaci
0,20120530064120Z,yeah well it would still be better than letting them sit there for years on my dime before sticking a needle in their veins i say give them all a noose if they choose to kill themselves so be it
0,20120612003945Z,um n xa nholy fuck i need a cigarette
1,20120502173058Z,you a moron truth is beyond your reach
0,20120529022638Z,you seem wistful
0,20120529141937Z,damn speedy recovery paul raining prayers down on you <SIGNS>
0,20120528151453Z,the laughs you two heard were triggered by memories of his own high flying exits off moving beasts
1,20120619203151Z,your anti semitic rants are not welcomed here you are a racist moron nfu <SIGNS>
0,20120620175146Z,nonstopdrivel was fredex on this team <SIGNS>
1,20120619033424Z,god you tiresome get a life you loser
0,20120612141919Z,stop pretending you not bradley side you the bs are u blind do not give us that stupid xa long xa explainations of yours xa you xa xa sounds like that idiot judges exactly carbon copy <SIGNS> arum we need our money bacck <SIGNS>
0,20120610012708Z,fucking weird game man
0,20120620031132Z,i told you i would give it if you did you started acting likje a tough guy behind your moms computer then i asked you times for an address and you still wo not give it
0,20120619055834Z,i do not know if lewis is a little boy or little girl either way it becomes the third on my list of petulant idiots you will understand when you grow up ask an old bastard member of your family to explain such actions cannot be tolerated how come you blame the line judge weird
0,20120620015832Z,thats a pathetic flop fuck you jvg
0,20120611195156Z,why should they bother improving ios if they sell more phones than they care to produce these advice are better served to the also runs wp first and foremost
0,,spursruss i live in argentina and its not all argentinians the problem being those who are loud on the issue are ill educated and you can be sure they would not be rushing to fight anyone they would be cowering in the background my wife is argentinean and she is the first one to recognize the stupidity of the claims some of muppet think they fought their independence against the uk morons the lot of them the answer is simple if we were the leading colonial force you would be an english speaking country you are not because werent it was spain portugal france our interests were commercial also the worst part is they themselves exterminated the natives the spanish started it but actually it was the newly formed argies which did most of the killing of the native lovely eh clueless stuff you wonder why the government gets away with corruption so many ignorant people thats why you shouldnt judge all by the standard these a huge amount of argies who see the cristina drum beating for what it is the same as all presidents of argentina do using it to cover their failing
0,20120527153941Z,you better hope because the marlins have a history of giving up their superstars
0,,well you guys have gone and done it now you put the words china and chinese up the required number of times for the dating asians ad to come up evidently ms zhang kg and cm for a bmi of from hunan china wants to meet me she has her little mouth open like she speaking what that you ask zhang well yes as a matter of fact i am a physician why are you clapping your hands together and jumping up and down stop that squealing young lady and exprain yourself <SIGNS>
0,20120620154731Z,you mean like your off topic obama rant bellow <SIGNS>
0,20120529035809Z,i hope they do it inconjunction with july
0,,surely will be a crushing blow when he does not get the next four years would you consider leaving the country <SIGNS>
0,20120611225404Z,i have not watched fox news in years true
0,20120528200101Z,are you in france <SIGNS>
0,20120620001100Z,i ll take that temp i really hate the heat
0,20120620070034Z,alexis bledel can act wait can she i have this blind spot when it comes to impossibly beautiful women shit maybe she ca not act fuck what the hell do i do now <SIGNS> n nwhat the hell do i do now <SIGNS>
0,20120612035513Z,i like your comments nhowever i would go one step further it not time to let the people of il fight back nrather the citizens of il just need to fight back period ni will carry next time i travel into little beirut i e chicago
1,20120619194023Z,fact georgia passed a strict immigration policy and most of the latino farm workers left the area vidalia georgia now has over agriculture job openings and they have been able to fill about of them in past year all you white real americans who are looking for work that the latinos stole from you where are you the jobs are i vadalia just waiting for you or maybe its the fact that you would rather collect unemployment like the rest of the tea klaners you scream you complain and you sit at home in your wife beaters and drink beer typical real white tea klan
1,20120530000452Z,of course you would bottom feeder
0,20120619201802Z,m xe tenlos <SIGNS> nhttp bp blogspot com yvszmvv irw tmo kfaugmi a k nllaahknnis s kill it with fire kill it kill it with fire s x jpg
1,20120619162450Z,you are xa a fukin moron xa xa you are just butthurt that you got rejected on wikipedia n ncall yoursilf scolar or whatever xa i am better than you xa just and already a wikipedia administrator xa you are just a stupid ashole
0,20120528135045Z,he is doing what any president doe on this day ni do not recall if other presidents appeared at the wall n nelection year yea but then again you would never say anything nif he did not appear you can not have it both ways
0,20120619193808Z,yeah and you a f ing expert go back to picking through trash barrels you tool
0,20120618201005Z,those trails will definitely get plowed regardless of the investigation they ll just see it as easier to plow the area than deal with it and once they got plowed i would never return or risk getting stopped and heavily questioned by the po po n np s all the stupid comments are unnecessary it really easy to be cold and heartless and act like you do not give a fuck but i like to see these anonymous commentators talk shit like that in front of this person family or even their own mother grow up children and learn some respect
0,20120529200220Z,suh had a sack the last time they played
0,20120612001540Z,and you are support argument a hole n nnot everyone games on their pc either xa spec whores miss the point entirely n ni prefer the mac to my daily work xa that beings said i also a big believer in the best tool for the job and there are certain things that pc do better database and servers for instance n nthe thing is that you havent proved anything other than an anti apple bias and name calling guilty myself to get your attention id just juvenile
1,20120619171832Z,you are a fucking dumb ass <SIGNS> go back to you xbox dickhead grow up you little fanboy
0,20120515062952Z,you know what would be fun if you guys talked crap back to us more entertaining
0,,beeline sidneycatsby i assuming you are in school in the states
0,,they should put all the gay and lesbians on an island xe x xa xc xa oh wait there is manhattan
0,20120610020958Z,yolo this is hilarious canyon students are so racist <SIGNS> even though most of us are mexican <SIGNS> fuck gabby <SIGNS>
1,20120502203704Z,lets see your papers arealconservati n ntill then shut the fuuk up sticky chin
0,,an interesting angle of organized religion is that religious persecution is never ok unless your defending your own religion xc xa you all are not victims of religious oppression xc xa you are the oppressors xc xa btw i not gay xc xa i just love how you people try to defend your persecution of others while claiming your are being persecuted
1,,correction bitch <SIGNS> you do not think it superb because your hating ass does not know talent and again i am still waiting on you to submit a video of you singing where is the youtube link i am sure you will get all kinds of rave reviews lol
1,20120611215519Z,i think the only trickle that effected you was the trickle of sperm your dad gave your mom and most of that trickled down her leg go back to sleep we will wake you when you are needed again
1,20120515142854Z,and you keep on your knees and keep telling yourself that is a sausage in your mouth xa and that is cream cheese you are swallowing
0,20120620125953Z,what was that like words about nothing you going after andrea mitchell what was fox infomercial not broadcasting yesterday how about the apologies issued for the epa drones and yet here you are attacking andrea mitchell about some stupid gas station gimmick n nhere another newsflash for you mr romney r is out of touch we all already know it mr romney amazement was not just about some gadget at a petrol filling post but that people could actually buy food products there and that they actually eat it n nthis very second mr romney is not even carrying a wallet and it is very likely that he does not even know where it is i still waiting for someone to ask him the tough campaign trail question of how much does a gallon of milk cost <SIGNS> n nandrea mitchell and gas station food unbelievable
0,20120619032603Z,rourke needs to give me a fucking like xa xa jwoude xa hows everyone doin <SIGNS>
1,20120514051227Z,fuck you both
0,20120619182936Z,powers n nmsnbc is far far more biased and hostile in it comments than fox at least at fox there are usually opposing views msnbc is just a shill for the president and they keep having to fire their hosts for all the outrageous remarks they make n nnow cnn is getting almost as bad as msnbc
0,20120527213608Z,what horrible trades are you talking about <SIGNS>
1,20120320212724Z,and retards like you back to the institutions
0,20120610004410Z,weapons lol hes an idiot an waste of human space had it made and ruined it all
0,20120529210906Z,not a big fan of rondo but the dude can ball i would not classify him as a big talker just trying to psyche himself up
1,20120619190700Z,pig maher you forgot your meds again you know you are one sick sob so do not forget
0,20120611201812Z,it not just the rich screaming about taxes xa it the average middle class american who pays his her taxes and does not see the benefit of those taxes but instead sees waste xa i pay federal taxes but i do not use public schools i not collecting any govt welfare or benefits i pay for my own healthcare etc xa i use the roads and sewers so i do not mind paying the city taxes xa for that xa my trash pick up is private so i pay that directly to the trash company xa xa everyone should pay for what they xa use not xa based on what they make xa xa if xa one wants to be a part of society one should xa contribute and pay their fair share xa that includes the rich or poor
1,20120320095936Z,mr king is not it about time you either grow a pair of balls or join the democrats who will love a pussy cat like you
0,20120619203524Z,i amused by the fact that weblog cons drop any issue once it turns into a loser n nthis is an expression of that amusement
0,,gabriel xc xa xc xa getting time to blow that horn <SIGNS>
0,20120529153517Z,exactly like i do not really give a shit how fat a person may or may not feel but it really is shitty when your clothes do not fit and not in a i so gross way but in a i ca not very well leave the house naked <SIGNS> way
0,20120619204714Z,welfare queen into a whore not a crack whore xa i think a whore is a more productive worker than a welfare queen
0,20120611235119Z,political correctness n npolitical correctness is a doctrine fostered by a delusional illogical minority and rapidly promoted by an unscrupulous lamestream media which holds forth the proposition that it is entirely possible to pick up a piece of ch t xa by the clean end
1,20120620063410Z,what an ass you are funny i see a lot more of you nuts in cars then i ever have of pilots in panes
1,20120530113926Z,you can take international law and xa shove it you are such a schmuck i don t know why i even comment on your idiotic posts the peace activists on the ship started hitting the soldiers with weapons in order to kill the
0,20120612023024Z,blown is a little pissy after he applied for a union job and was turned down he is just another good republican minion spreading today message
0,20120619224557Z,if you dont have a teleport and air mix ups you are nothing to me
0,,stop trying to sound like a victim bitches dont understand men dont have the same temper and not the same thoughts go through you mind than ours u put a nigga on da spot get up in his face and start throwing yo stank breath on us believe me u got it coming yal go no right period
0,20120610065027Z,robert moroni you fuckin dimwit do you know what a parody is it a fuckin parody of fox news and it sounds accurate to me <SIGNS>
1,20120514051108Z,the most evil callous vile creature in all of mythology is your made up god stop killing and eating babies you dirty christard <SIGNS>
0,20120620181659Z,oops <SIGNS> xa how embarrassing for me you are right people st i bow to the superior movie intellect of your son
0,20120612031614Z,if you throw trash out your window you get a yellow star bumper sticker
0,,once more we see where the soft immigration policy has let the citizens down i bet they come from a family who have less education than a retarded hampster yet were given a nice new life in britain reap what you sow
0,,nope not working for me either w facebook com annagillmodel n n n nyou have my email <SIGNS>
0,20120514051012Z,that jump shooting bit gets old when you do not get calls on contact and get your shot thrown off you look for separation and you jump shoot especially if you ai not big which is most teams because bigs and longs are rare expensive at pro level
0,20120528033457Z,this was a tough loss for us right now there are guys blowing each other in the locker room n n scott brooks
1,20120320210420Z,you a complete and utter moron
1,20120528221848Z,your still a loser man we must have really gotten under your skin lol
0,,the ignorance here is astounding clearly it says in the video that cleveland was already convicted of rape and is serving jail time for it he guilty she was raped <SIGNS> for all of the morons who said ugly statements about her or attacked the veracity of her story the only determination that this court is trying to make is whether cash money should be held liable i think it reasonable that when you invite someone to make a professional presentation at your company that you provide necessary protections for that individual i don t care whether cleveland was employed or just a hanger on a professional guest should not have been left unattended in the hands of someone dangerous that was there admittedly with baby and slim knowledge and permission if you went to a store and were attacked by an employee or a friend of the boss who was permitted to hang around premises would you not hold the company responsible <SIGNS> xc xa
0,20120620153735Z,fuck hard then fuck slow then fuck hard and then start again
0,20120529130655Z,axlrodes xa were you here for the wide receiver drama <SIGNS>
0,20120611211947Z,are you fucking kidding me no mirrors fuck you freesteam
1,20120618200449Z,nothing was confirmed in the th century you moron there was no modern medical science to prove anything dont try to quote from the same period of time that brought us the spanish inquisition you are the lowest of the low i feel sorry for you
1,20120619175937Z,my best friend who is allergic to wheat corn soy red dye yellow dye pistachios tree nuts kiwis cherries oranges bananas and seafood if she gets anywhere near the smell of seafood her lungs constrict and she can no longer breath last week she got cut by a dog leash that had pistachios on it and almost went into anaphylactic i know a little about food allergies xa n ni asked my friend if she thought it was rude and selfish of someone to want food allergies so they could die she said you are a bitch so i do not really think it is insulting that she wants food allergies so she can die i think we back to you a bitch
0,20120527182916Z,so not focusing on boston vs miami for a minute who the scarier opponent sanan or okc <SIGNS>
1,20120610162400Z,floyd has a better knock out percentage than pacman you dumb fuck
0,20120612082854Z,so wat have u bn doing all along if u want to train them nw we thot yo presence must strengthen the strike force bt proving otherws shame <SIGNS>
0,20120619014349Z,the dean of mean is a typical tory who believes there one law for him and another one for everyone else nbig steve better get around to firing everyone at elections canada and replacing them with tory hacks before they really get into what the tories did in the campaign
