Insult,Date,Comment
0,20120610065939Z,sanyu i suggest you get over cute and become competent intellectually if you reasoned like buess i would think you are compentent the way you sound makes me think your brain is in you panties nbluess great reasoning great questioning and indeed you showed a sense of patriotism nsanyu pull your brain out of your panties have it in the right place you might reason better than you do here
0,20120619180737Z,julissa is fucking annoying
0,20120619185507Z,natesweet xa n xa nheh you said tightly then you said loosely
0,20120528180247Z,hi mary loving this weather <SIGNS> unfortunately ca not go far it figures
1,,i hope you liberals progressives soc ialists com munists who are commenting here are really proud of yourselves with your fi lth y comments about ab xc xa keep it up xc xa it shows who you really are a bunch of snarky ha te ful elitist de cei tful and dec eived useful id i ots of the dark xc xa crawl away slim ers
1,20120620143048Z,yet here you are day after day supporting the paper by clicking on links and making comments increasing site traffic n nyou just cant cure stupid
0,20120620051201Z,waves back while holding up a sign saying n n n the pipe works better if you light it
1,20120619130050Z,wtf are you talking about more important shit like taking time out of your life to comment on me calling another nigga ugly hmm yeah your still in middle school
0,20120529020419Z,i hope the gobbly gooker is a unlockable character on wwe
1,20120320105309Z,i no liberal you cocksucker just not so stupid a fucker as to shoot a kid going for candy you a puzzy that is scared of shadows
0,20120527225206Z,the k the klu klux klan the military wing of the democratic party <SIGNS> nlol <SIGNS>
0,20120620035027Z,you calling others ignorant assholes <SIGNS> hahahah that is a fucking joke
0,20120618194334Z,added those quotes at beginning and end of the track bwahaha it alsum
1,20120610023331Z,rec just shut your mouth with your neo nazism you are just a weak minded social reject compelled to strong leaders like hitler because you cant fend for yourself
0,20120612141257Z,one of our best and most honorable presidents
1,20120618221909Z,if its so lame why did you read this or for that matter search this topic maybe you should think a little more before you make yourself look like a fucking hippocrate
0,,yes man fell our pain but on the other hand we can handle they ass you just need to show em who boss they can get they little attitude as long as they dont cross that line
1,20120320184900Z,you are an ignorant piece of sh t
0,,is it just me or does that picture of david brock scream i can suck start a b
0,20120611183055Z,diablonn xa finally someone else seems to get it it just a game get over it people as someone who has actually been in combat i appreciate them actually talking to people who have seen it todd if you want to realism join the military these are games games are fun your mad because of a regenerative health if that the case do not play shooters xa todd logic is rediculous the combat is not realistic really no <SIGNS> hey todd just play red river and stop writing articles about this subject and like i said i a vet and the game dos not piss me off your pissing me off it seems to me you think your doing hard nose journalism by questioning the realism of a videogame well todd in reality you failed and instead of badgering them because they used the word authenticity maybe you should spend more time reading a dictionary
0,20120529201507Z,well considering lebron james is pretty damn good in the post season exluding the finals and peyton has not played his best in the post season it have to be lebron peyton is not a choker though
0,20120609175337Z,obama commands the lead in under k a year and under bracket only romney is ahead for k and above incomes
0,,that hexagonal crown matches the watch so well as for modern watches i love the seiko orange monster
1,20120502202704Z,i a butch woman wo not you come try and whoop my ass you weak ass sniffling little troll <SIGNS> in fact better yet bring your wife along she almost hot and i sure she hightail it away from you boy <SIGNS>
0,20120502212212Z,i can understand your appreciation for jack but did you really have to let us know what people call you next time please remember to check your punctuation you left the period out after starts
1,20120620124806Z,i am not dude you moron <SIGNS> go back to your mothers
0,20120619195851Z,if you had a login you can find for yourself that apple did not invent nor is the technqiue used to pack in more pixels new on displaysearch n nhttp w displaysearch com cps rde xchg displaysearch hs xsl index asp xa n nthe technique here along with the ipad was invented by engineers in sharp a japanese display materials manufacturer jsr
0,,were the people who were against civil rights as dumb and angry as the people who are against gay rights <SIGNS> xc xa n npretend for a moment that you put the constitution and bill of rights as your highest documents when evaluating u s laws and policies xc xa how can you possibly contend that gay marriage is an issue at all <SIGNS> xc xa n nthe only way that you can contend that this is a huge issue is if you put the bible ahead of the constitution and bill of rights ignoring that this anti tolerance thing is not even universal across christianity xc xa n nso why again should religion be a leading factor in whether the legal and financial agreement that is marriage is allowed between two consenting adults regardless of gender <SIGNS> xc xa n n
0,,way to go sweden getting your ass handed to you by americans xc xa
0,20120530015950Z,rays lose <SIGNS> rays lose <SIGNS> nbaltimore on brink of losing <SIGNS> noh ya baby red sox are on edge of a win against verlander <SIGNS>
0,20120527194747Z,thank god the western conference playoffs continue today the east is pure garbage
1,20120610103529Z,are you guys fucking retarded you trying to take pictures of these girls <SIGNS> you guys are worse than the scum of the earth
0,20120609200041Z,yes but he had a distinct view on this continent in particular something to the effect they had gold and diamonds literally in the dirt beneath their feet yet in the thousands of years they walked its surface they never bothered to look down and imagine the possibilities he elaborates on the subject
0,20120612125009Z,yes he should of asked politely please stop shagging my daughter
1,20120619004436Z,pepes list updated n n nbest place to get your dick sucked n n nhialeah swag house n nbetween him and his mom te sacan la espumita
0,20120527233726Z,are you in thailand <SIGNS>
0,,jasamoah your a gloyte do one
0,20120529044822Z,what are you talking about <SIGNS>
0,20120612125211Z,a car wreck <SIGNS> xa this looks more like a car pileup on a fog shrouded xa icy road to me <SIGNS> those involved in the crash at the front can xa hear the vehicles crashing one by one in the xa back with no end in sight
0,20120620072544Z,i sure hope bravo shares this as i have posted before and have never been published
0,20120611211333Z,let me educate you you do not go vote for the nominee that is a vote a xa obama supporter xa votes for obama plus one for obama nnow if you vote for the nominee it washes that plus one out to nsee how easy that was
0,20120610065834Z,noynoy aquino is an ugly mother f u c k e r <SIGNS>
0,,the obama nation will rise
0,20120618201355Z,he will be charged with vehicular homicide he will probably do months in a juvenile facility and get his record expunged after completing probation
0,20120612033650Z,why do not the citizens of chicago that live in that area protect themselves they can think mayor daley and the rest of the puking liberals for this type of violence yes that is correct the puking liberals have taken away the rights of the everyday citizen if every law abiding citizen had the right to have a ccw then things would be different i say just go ahead and carry it is better to be judged by then be carried by if a few of these punks would be shot by a citizen i believe the punks would think twice before attacking citizens and do not tell me it happens in other cities states have ccw and they do not have these types of problems n nwake up people and stop waiting for the police to protect you and protect yourself n nthank you
1,20120612153437Z,what funny as hell is rooster and you being married retard
1,20120612011922Z,chasm when you spam like the village idiot you are you will never get any converts to your stupid political bias cause xa nice pointy tin foil hat you got there too bud <SIGNS>
0,20120530031454Z,or rob me scissor hands giving school kids a hair cut
1,20120612004040Z,would it make ya feel any better if he was molesting girls you really dumb but you dumb by choice you choose to ignore everyone telling you facts but you choose to be dumb
0,20120619184036Z,fucking hotest blowjob ever
0,20120515231229Z,ustaadji you are the greatest <SIGNS>
0,20120610052534Z,fuck
0,20120530151538Z,kuyt will wait to see what the new manager says about his playing time next season before he bolts
1,20120320174257Z,you are a fool
1,20120320202742Z,sorry are you lost little boy the men are talking please take your whineing else were xa and notice how no body sad anything about cod
0,20120528210022Z,probably it is memorial day after all a good joke on barajas part and a sign of a wounded vet
0,,so i guess all the person had to do in the article was bitch constantly about a game that so many people have bitched about for ages and then they win the bitches over wow as far as stop trivializing violence goes why dont you stop sounding like a big ass c sucker and don t play games with violence then i get so tired of all these holy sounding types that get touchy about video game violence n n i seen blood diamond a dozen times with the kids killing and getting killed and it doesn t even phase me one bit only because its not real sure there is an emotional sense there but not enough to make me write to hollywood saying gay sh t like stop trivializing violence because its disgusting why does a game have to tone it down when movies don t i not defending cod in the slightest and that because i don t really care about the game but when i read the headline of the article i was curious to see what others were going to say but i knew hands down it was going to be an attempt to throw punches at a series that has sold a lot of copies already all i can say is it doesn t matter how you feel when every other gamer that plays the game probably can just deal with the game no matter if it changes or not n n sitting on your overgrown ass complaining about a game being this and being that just because you don t like it is stupid as hell i hate jrpg games and why i also hate anime with a passion because i can t stand cute crap i hate that overly sensitive bs with the characters i don t like japanese music either unless its instrumental war drums or something out of samurai warriors or kessen where it doesn t begin and end with a stupid asian chick trying to sound like shes an innocent little annoying or year old i hate high pitch whiny sounding voices too and no japanese voice acting does not mean better over american voice acting because it still sucks regardless n nbut i don t go near the stuff even though my brother plays jrpg games a lot and that means i can t really escape it when we both in the same room and i studying while he just playing his sissy games the fact still stands that i don t intentionally go near things i hate just so i can whine about hating it like cod haters constantly go near call of duty to claim that they hate the game when its easier to just simply stay away from it don t buy it try to pretend like it doesn t even exist i will not lie to anybody i like violence in my games people that walk around with a d ck up there ass crying foul about cgi characters dying and getting hurt probably scream when the doctor comes at them with a needle as far as call of duty having to change goes well that depends on whether or not a lot of people want it to change and not just the people that bash the game on a consistent basis either i talking about people that really feel or believe it should change a few things and have accurate reasons why just simply saying cod is for year olds and needs to change this or that if anything the cod players are the ones that should change
0,20120530040455Z,we are trying hard to beat yankees so you pick up a game on them
0,20120619030430Z,very very very xa very very xa very very xa very very important studies <SIGNS>
0,20120619003844Z,a role model to fools idiots and rubes
0,20120528222745Z,you do not seem to understand basic business concepts
0,20120530124345Z,that ridiculous everyone knows men from mars are purple
0,20120609182601Z,who needs these agencies we can determine for ourselves what is good xa who needs some authority to tell us what is right or wrong as to collective impact on the planet n nwe would still be pouring waste oil in the ground to cheaply dispose of it if that mind set were allowed to predominate
0,20120610095249Z,what you do not know about gulags check out the history of the soviet union warning it may disillusion you about communism and comrade stalin
0,20120528033150Z,lebron durant you two did not deserve mvp n n tony parker
1,20120620003324Z,taxing people at different levels is not redistribution of wealth you fucking retard xa that like saying a fat person is redistributing fat by eating more
1,20120515214935Z,stop wasting our air you idiot
0,,eustace tilley david yankeeclipper that cause you not getting enough oxygen she sucked it all out of the room
1,20120610065523Z,how can you possibly be such an ass hole all the time jesus this is exhausting people that say they have big dicks generally have small ones hahah believe it or not i defended your bitch ass when you first joined the website pussy
0,20120619030645Z,i great rhunt you got to see a terrific game today <SIGNS>
0,,golly that cold comfort but none to worry by the end of this month israel will have taken care of the entire issue with iran and syria with one real nasty blow allah aint so great after all
1,20120612094046Z,i am going to hate all over this page because ihomophobic fuck off lesbian good thing that bitch died one less lesbo in the work
0,20120609232542Z,if it walks like a duck and quacks like a duck it either guest speaking or in fact a duck
0,,lltrix mass murdoch if you going to call someone either stupid or ignorant you should probably end the question you ask afterward with a question mark not a period
0,20120515172057Z,lucky you sasha so what your beef other folks taxes are paying for your ride
0,,xc xa too many like it or not we suck with him for another years unless the republicans can pull a rabbit out of a hat the best we can hope for is a republican controlled house and senate
0,,heaven forbid someone who is a bit of a celebrity should express non liberal views xc xa n nas a hockey fan myself i really do not think the very talented mr thomas needs to answer to any lame ass sports reporters or anyone else xc xa he entitled to his opinions xc xa after all prior to the current administration we used to uphold free speech for everyone n nbesides he a stanley cup champion xc xa nuff said
0,20120620030446Z,nwo fuckinglife
0,20120528002538Z,all da hoes love me you know what it is xa rack city xa bitch disqus
1,20120620054655Z,do your job in hate loser
1,20120320133559Z,crawl back under your bridge you miserable pathetic troll
0,20120515200128Z,you are full of schnike sir
1,20120620173713Z,ponyfags fuck off
0,20120619064516Z,this is fucking primordial <SIGNS>
0,20120529150126Z,he rushed for for i think the threat of him running loosened up the pass defense last year
0,20120619030929Z,racism will die when white people stop being racist
1,20120620162209Z,you are completely clueless
0,,iran is going to be blow up one way or the other give it up <SIGNS>
0,,i am a sales arborist in the dc metro area i have grown all too accustomed to the status quo set by service magic as a credentialed and educated professional in my field it has become quite disturbing to work with the environment that service magic has created i e a false sense of qualification of vendors to the consumer i have spoken with many arborists from other firms in our region and all say the same thing this could have been a beneficial service but without demanding proper insurance and credentials from its vendors it simply becomes a means for the unlicensed and uninsured vendors to gain business they are not qualified to perform this also leaves the qualified professionals such as myself without a fair cost comparison to offer our clients the fact of the matter is companies pay tens of thousands of dollars a year for proper insurance not to mention the cost of education to aquire proper credentials service magic comes along and opens up an outlet for those who have not performed their due diligence in aquiring these necessary benchmarks to practice their craft to be solicited to the masses as qualified vendors it a shame and has become a menace to the integrity of my profession and those of us who have worked hard and payed countless dollars to make ourselves a true qualified vendor my hope is that the people at service magic make immediate change in their qualification of vendors
0,20120609201605Z,nolimits please consider helping with the xa president obama campaign we need people like you
0,,until medical staff are held accountable in a court of law mistakes like this are always gonna happen nhs trusts dont care about fines as it is ony tax payers money and not there own
0,20120619203158Z,having read many of drago other comments on this site it is not shocking he does not get game of thrones n nhodor has more sense
0,20120527155016Z,because we got that dback killer zito going in game he is undefeated vs your dbacks this year lol that do not get old ever
0,20120530110256Z,i ll buy the rope so the tax payers do not have to choke up any money c w shovel
1,20120320122739Z,you can get treatment for your dillusional inferiority complex you sad little troll
0,20120611234239Z,a lot like you and your life huh <SIGNS>
1,20120320190003Z,damnit gw do not be such a pussy you liked the white you should have stuck with the white
0,20120612004722Z,proof or just another unfounded ridiculous republican opinion what were you watching fox news when they talked about the study that said fox news watchers are stupid you have just proven them right congratulations
0,20120620000651Z,we knew we were in trouble from day one xa nobel peace prize for what <SIGNS> what afucking joke
0,20120530043239Z,i so happy for them <SIGNS> they really deserve it
0,,your buddies repub turd raibox cyndyb nww nav are all having a party with the obama blow up doll you should join in before the kool aid gets warm <SIGNS>
0,20120529200528Z,they certainly have hospitals for the criminally insane which judging from what i read of his verified history is where kimberlin probably needs to be
0,,notborneverymin mickey bitsko icah carter i not going to make this easy for you n nhttp w youtube com watch <SIGNS> v y zadrfpb k n n
0,20120619011214Z,in the federal government only consumed of the national wealth today it consumes more than
1,20120320201831Z,no you are just stupid
0,20120529000020Z,the first draft dodger who became president was bill clinton
0,,massive pisstak
0,20120529020537Z,maybe they did so thanks to jeff van gundy outcry on that
0,20120619170204Z,my issue is not with the shoes xa i do not care about them xa if they invoke a certain response or emotion from someone it not up to you or i to say someone should feel that emotion xa who the heck are you xa that how jesse feels xa that not how all black people and these comments demonstrate one of the reasons why race relations have a long way to go xa there are too many ignorant people still breathing to have a serious dialogue about it xa stop telling everyone how they should feel and maybe just listen xa no one told the majority of americans not to have an emotional response to despite the fact that they were not impacted directly xa did anyone berate you about getting over your hurt <SIGNS> xa xa you understand how you can be moved in that instance but other people are just crazy because they were not a slave <SIGNS> xa n nyou want to dictate how people talk walk dress go the bathroom etc there seems to be no limit xa n nadidas has every right to sell the shoe and people have every right to express how they feel about it xa you know the same way you express how you felt about
0,20120620172858Z,and he shrugs off his rock once again tonyretardo <SIGNS>
1,20120620000759Z,you are a xa really well rounded idiot are not you <SIGNS>
0,,mickey bitsko icah carter i sorry what is your dispute what is your argument you asking me to check what out in particular <SIGNS>
1,20120320152207Z,yuck imagine knowing a total fucking douche like you <SIGNS> your mom should have swallowed dude <SIGNS> she did this world an injustice <SIGNS>
1,20120612032513Z,ok now your getting silly which is not a surprise coming from liberals like you
0,20120619075125Z,when you know you are little by little achieving your goals it will help us inspire ourselves
0,20120528222634Z,must be what happened when they saw you soledad xa wearing your thong and xa nipple ring as you went to sleep in your fox hole secretly dreaming of the soldier next to you
1,20120611234126Z,i rather see you getting lynched <SIGNS>
0,20120609210455Z,those chicks are badass i would be puking if i had to drink a shot glass of either of those
0,20120619130322Z,omg jesse jackson go back to your cave slavey is over and has been over as a country we know we messed up but to our defence it was tribal leaders who sold the slaves to us but regardless slavery was officially ended over years ago and i doubt anyone alive is a former slave so cry me a river build a bridge and get over it already you wouldve thought all those people standing on that one soapbox it wouldve broke
0,,for a stupid ugly girl she seems to have gone rather well for herself big house expensive cars millions in the bank still i suppose all those girls crticizing her can match that and are better looking as well and the fellas have better looking birds yeah right
0,20120619180246Z,wait till you see my romney imitation i love firing people corporations are people my friends and my favorite i not concerned about poor people
0,20120611222632Z,you are a victim of the modern educational system
0,20120619201605Z,mibearfan xa n xa ntouche just letting you know i plan on talking an inordinate amount of shit about this out of all proportion i say <SIGNS>
0,20120610140734Z,to anyone bothering to evaluate obama on his words and actions vs having someone else do the evaluation for them he has never been anything but a pragmatic centrist the problem with such a position is that the extreme left will claim a betrayal to an ideology never subscribed to the extreme right has made it crystal clear that not only do they consider liberals sub human criminals but they have no patience for moderates of any stripe and the overwhelming majority of people who are in the middle are not political wonks and do not have the time necessary to try and figure out the truth through all the spin so they are unfortunately left with the impressions of whatever sensationalist press last got their attention
0,20120612002617Z,gee scholarships for blacks only can you say racism <SIGNS>
0,20120619014445Z,cy said xa june wins that is looking xa pretty xa close right now
0,,donpardo or it our worst nightmare as we slide to the rd or possibly th best qb in the division mercy
1,20120320160801Z,i bet you take monstrous shits
1,20120530053907Z,you are despicable and disgusting
1,20120610121506Z,i think one might get rabies from biting you do you actually read what you type you a psycho and you may be newish here but you sound like this old fart who used to fill this forum with similar mindless drivel n nwhy do you hate romney so much clearly even such a mentally senile old dip stick like yourself recognizes that he is nothing more than the white version of barrack obama i do not really think you on drugs only someone mentally disturbed can sound like a as much a crackpot as you do
0,20120610003141Z,ut there obviously a bit of sarcasm mixed in with some common sense in the post thanks for reading n nhave a nice weekend <SIGNS>
1,20120618194436Z,and he helped to remove xa mubarak by <SIGNS> xa oh i forgot he was demonstrating in cairo all those nights back in xa you are so blinded by your own political stupidity
1,20120529025940Z,you reaching i am a proud american you still an idiot
1,20120527211510Z,u are a sick moron
0,20120609191013Z,the boy just ca not help it xa lol <SIGNS> xa n n a slime a day will keep obummer away <SIGNS> xa xa go slick willy <SIGNS> n ni guess you really ca not call it a slime when he is kinda telling the truth xa n nromney <SIGNS>
0,20120514051328Z,hey wade why do not stop doing your hater and start argue with arguements actually you are not really useful not at all
