Insult,Date,Comment
0,20120611184750Z,henry hawk n nthe cases that you have cited are not applicable in this instance n nalso there is no known conflict statute within any us state with granting obama lfbc full faith and credit n nnor is there a credible record of a statement by obama that he was not born in hawaii as you have suggested
0,20120529151615Z,good job eric xa you defended yourself against your unarmed little nbrother who you claimed to love xa you took that gun with you on npurpose and you darn sure got to use it as you intended n na little harsh are not you nothing like piling on when the guy on the bottom who admittedly made a huge mistake is already feeling terrible about it you are in no position to judge him perhaps you should try walking in his shoes his life has been changed forever and i doubt he premeditated to kill his brother that not how accidents happen was he careless yes but i doubt he a murderer
1,,oh you xc xa sit down and shut the fuck up you mental retard <SIGNS> what the fuck do you know retard <SIGNS> i hate people like you <SIGNS> why dont you go get violently killed in a car accident you fucking retarded dick headed bitch mother fuckin ass hole <SIGNS>
0,20120618201320Z,hi ally xa glad you liked gambler gal xa she would be my alter ego if i had a bunch of moolah to spend xa alas this is not the case xa i like the penny slots too but you can sure cram a heck of a lot of money into those machines if you not careful xa xa sheesh nhugs <SIGNS>
0,20120619224149Z,guess what op i a i real girl i that i likes i wearing make up i likes i wearing my hair down i likes i being dressed nice and sucks at call of duty s my strategy is to spin in a circle and shoot everywhere shoot those motherfuckers s n n nwhat now <SIGNS>
0,,xc xa supposedly a very rare pattern in the c position or sometimes referred to as the bullish doggy style manuever take your pick <SIGNS> xc xa lol <SIGNS> http w screencast com users hoof hearted folders default media e f c ba a very suspect though <SIGNS> if someone has posted this my apologies i not seen it
0,20120528102624Z,maybe he is canadian would explain why he is gutted not to be going
0,20120530102033Z,oh fuck yeah he not kidding guys it images from the attack and holy shit they are in a whole new world of graphic
1,20120619204911Z,evel dick gets my vote james r is a very creepy looking man mr rogers look alike plus he whined like a little bitch when janelle destroyed him in the otev pov comp
0,,adam hey a was thinking about you today cause i was listening to some old blues how is it going <SIGNS>
0,,i have watched the video over and over again and with all the evidence ballotelli did not delibratly stamp on parkers head for a start parker was behind mario when he fell and in doing so knocked ballotelli off balance and tripped over hitting parker in the head that what the ref saw the rest is history
0,20120612042541Z,yeah they pick up the trash then go thow it in the yard aroud their trailers
1,20120609173456Z,berethor go ahead and try dude go fucking ahead
0,20120610165355Z,so a single parent is better get off your fucking high horse and shut the fuck up can you even imagine the trauma the two girls will feel and the loss of the other female partner wo not change the other mother from being gay i hope you realize
1,20120620175331Z,rob you have proven your point already we understood you are an antisemit you can relax now
0,20120620022954Z,faux is a better source of animus
1,20120620030152Z,it is a great honor to be a zionist you are garbage a retarded idiot
0,20120609212040Z,sorry but that just a dumb statement you comparing some rd party promo to apple own functionality for example if this were a reference to a carrier removing google navigation and forcing customers to use telenav you have a valid argument but not in this case n nif you want to make odd comparisons let talk about how the iphone fucked everyone on sprint who enjoyed yr contracts longer return periods and other perks that got taken away all because of the iphone see that why i like android because they do not make the carrier take one up the ass and screw their users out of perks they enjoyed for years
1,20120529172614Z,sgboy get back to your cot i hear your parents calling for you
0,,peevedmichelle um good question please email polly blogher com
0,20120609205338Z,looks like you have a stormer problem <SIGNS> the same team that beat the bulls twice habs and jean were great morne spies xa and hougaard was below par crusty the clown dont belong in this company
0,,joey barton only has a twitter account because he wants people to massage his ego
1,20120609210616Z,you are a pig
0,20120529213525Z,got your back here r dale good post typical of the gun nuts in utah
0,20120619025608Z,his wrist might be bothering him he got a chip floating around in there
0,20120612031140Z,based on the architecture stucco building and foliage oh and the dancing gay black kid i betting this is from florida
1,,fly away gay pusy fly away
1,20120611225158Z,we not the losers but xa you and this country are
0,20120619040251Z,you have a beautiful body what wrong with a man looking at a woman with a beautiful body especially nice hips if i stalker for that then every dude i know is a stalker as well
0,20120612032918Z,looks like a case of cat on keyboard disease
0,,go get them egyptians xc xa kill them all <SIGNS> xc xa we will be right behind you xc xa xc xa hahahahehehe n n genesis xc xa he will be a wild ass uncivilized of a man yismael and his descendants his hand will be against everyone meaning a robber per rashi and everyone hand will be against him meaning everyone will hate him and will attack him per rashi and in the presence of all his brothers he will dwell meaning his descendants will be many per rashi
1,20120610023717Z,commenter <SIGNS> xa your very childish xa grow up and be a man xa stupid remarks like yours just proves that you are a little boy and have yet to understand what it means to be an adult
0,20120620014816Z,awesome font and color on your card
0,20120529004355Z,not tonight tv chill with that nthe brewer and dodger fans are just enjoying the game nwherever they are hoping that their team wins nsimple ai not it <SIGNS>
1,20120320202256Z,provide proof faggot
1,20120612024132Z,your mother is the clubhouse whore
0,20120620005841Z,your mother
0,20120515202707Z,that because you posted all lies and bullshyt <SIGNS>
0,20120515164147Z,his poor mom she seemed pretty cool how the fuck did a person so nice end up raising such a cunt <SIGNS>
1,20120515155714Z,take your testament and shove it
1,,suck ya dads dick ya stupid slut he waiting u u probably ugly as fuck damn i know it sucks to be you trollin on a joke i made fall back b ihurt yo feelins ho
0,,xc xa yes god gave us free will xc xa no matter what the sin is sin is a choice people were not born gay xc xa somewhere in their environment or upbringing they chose that lifestyle xc xa there are people who enter it and leave it every day
0,20120529233847Z,i do not go to the woods this time of year to hot too n xa many chiggers i stick to shore until it cools off <SIGNS>
0,,gloves on the baby please
0,20120529223205Z,why do not you think he ll be worth it <SIGNS>
0,20120612143504Z,there far worse things happening in africa and where your humanity towards africa more than half of mali has been taken over by fsa best mates al quaida mauritania still has a slavery system going on chad niger darfur south sudan are on the brink of famine somalia once again fsa best mates al quaida ruining the country north eastern congo there deaths and mass rapes do not you reckon some of the issues in africa are far worse than syrian regime battling terrorists
0,20120619164200Z,you are spot on in regards to that little brat
1,20120619131405Z,seems like you are on tik you moron <SIGNS> are all people of your colour rapists of mothers and children i do not think so stop making idiot comments <SIGNS>
1,20120620013234Z,you certainly come off as an arrogant s o b your right ends when the safety of others begins i do not give a rat arse that you hunt but keep your bullets along with your second hand smoke away from me sheffield village is a sprawling area and you are living in the past you sir may have to find a new piece of hunting paradise to fulfill your desires as far as history goes tyhe indians hunted all over places change get with it or get out <SIGNS>
0,20120609171343Z,the existence of the interstate highway system hardly outweighs the vast amount of other problems with the federal government n ni hear a lot of you can thank bush and cheney from you but what has your precious obama done to reverse any of that <SIGNS> xa oh do i hear the letters ndaa <SIGNS> xa i think i do xa obama is as much a globalist stooge as those two are n nthe borders are indeed open and if the federal government could accomplish it politically and they will not stop trying they indeed would not be illegal aliens n nyou think you are being funny about the violent savages comment but what good will come of importing masses of somalians mexicans muslims and haitians do us <SIGNS> xa these people as a general rule are violent and backwards xa i see no need for the existence of ms in our nation xa n nyou seem to think that i support bush cheney or romney xa nothing could be further from the truth xa these people are all globalist zionist scum like your much favored obama xa why is it that it is so hard to see what is right in front of your face <SIGNS> xa obama is a sellout to the transnational elites just like bush is xa n ntheir intention is to destroy us and you seem to have your head in the sand
0,20120611200315Z,thats what i thought about herge but turned out he was just opinionated as fuck n n nturn the other cheek
1,20120619234723Z,whatisbannedisneversuppressed n nyou just a sorry ass commie are not you too lazy to get out of bed to better yourself n nmuch easier to sit back and let others do the hard graft and hand over money to you to live your commie dream n nnever mind thinking big try working big that what benefits all n nyour type make me sick to my core
1,,how stupid are you do you realize that many women take birth control pills for many reasons besides preventing pregnancy educate yourself fool
1,20120620103547Z,fucking idiots
0,20120620020918Z,durant needs to do something fine a way to get him free
0,20120530145624Z,laird ans avila and santos may be among the tigers most marketable players at least as far as trading for a starting pitcher or a starting b is concerned
1,20120529151717Z,you a fighter not a lover and your family needs to die too
0,,beatles life but tna is full of tired wrestlers so should not that be has been wrestling too <SIGNS>
0,20120529051156Z,where do you find time to record an album when you on trial for murder <SIGNS>
0,,xc xa xe x x cit puts politics between women and their healthcare xe x x d what do they think they are doing both sides are putting politics between americans and their liberty nas an aside the only reson the left wants people to have all the abortions they want is because they want to control who can and can t have children they want to create the master race themselves xc xa women rights <SIGNS> xc xa sure like they actually care if they did we have occupied the middle east a long time ago in the name of saving women from rape mutilation and murder <SIGNS>
0,20120528182522Z,i love a coach that can talk naughty
1,20120529025144Z,ok you are a complete retard re read what you just said about a bullpen you know nothing about baseball <SIGNS>
0,20120530010711Z,tampa is loosing also they may give us yet another break <SIGNS>
0,20120611182425Z,to be honest dont you think that some fool made this fake twittwer account up <SIGNS>
0,20120611181753Z,there is no way roger maywheather said these things his account was definetely hacked into no man of his position will say these kind of things i mean he would not talk about another man wife in that way
0,20120528144444Z,is this a defensive stand for theo or an offensive jab at paolo they really are not the same thing if you been reading him that long and dislike him that much then ignore his comments the irony is many of paolo views and opinions bring the good cub fan out of many of us rahrah the guy was a military drill instructor devoted to creating fearless fighters he just does it on a different scale now creating fearless fans out of fair weather fans just sayin man
0,,no they choose to be gay for the same reason jerry sandusky chooses to f boys in the rear it deviance and i agree once they are caught up in it it nearly impossible to stop but it is a choice xc xa
0,20120620030603Z,last summer is xa ne vs suju right <SIGNS> xa and now this summer xa again ne vs suju xa fuck they forgot b st ahahahahah
0,20120612040248Z,hey when you are in public or on the internet you cover your private areas with clothing we do not want to see porn and that includes your butt
0,,it gets more and more like butlins as the weeks go on
1,,stfu u dirty ugly wet musty hair havin rican <SIGNS> dirty ass wetback <SIGNS> i swear i cant stand u dirty ugly pale face wannabe white spics postin racist bs on wshh when u the least disliked group of ppl in america <SIGNS> ima spit in the next lil wetback kids face when i see em because of u
1,20120528114508Z,that is a moronic response they should not repeat the crimes they commited please don t post your trash here
0,20120612123131Z,please use your search engine before you look any dumber xa or just go straight to the police information so far
1,20120618202459Z,by your kind i mean angry little yankee know it alls who are complete white trash in the states they came from and move here and think they know everything because southerners are slow and backwards you were trash up there and you are trash down here go home and take all of your friends with you you are ruining our culture and quality of life although you sir would not understand anything about quality of life you are a pathetic internet troll who entire life is sadly based around your pathetic rants on message boards go home dude
0,20120514050733Z,the fucking website said it worked for a devices only now i in n do not have shsh blobs just learned about those ifaith ndoes not recognize my ios and i have two different redsn w versions that n now do not mean shit it great that you guys work so hard but nplease check your posts <SIGNS>
0,20120514051016Z,ha ha wait until you have your own kids
1,20120503035306Z,now you went and fucked up this whole page
0,20120618223920Z,there are many great jews i have no issue with the faith
1,20120503034615Z,you know it is so easy to talk shit about this you know nothing about what he was going thorough in his life so fuck off <SIGNS>
1,20120528233058Z,pickle n nyou look like brian scalabrine brother thoughts <SIGNS>
0,20120530014930Z,providing oil companies with billion to offset their costs for exploration is socialism is it not that little gift did not come from obama it came from bush
1,20120620130801Z,and you need to know classified information because when it passes into history there is little anyone can do about it and in the meantime you really do not need that information i guessing you just want to feel smug about getting it
0,20120612010436Z,crap your chick as got a run
0,20120618211456Z,yeah but we love a good smack down
0,20120611190438Z,clintons shirt should read way to go barry i screwed a intern you screwed the whole country
0,20120611202808Z,i think i in love with you
0,,they fucking slayed <SIGNS> n nthey just slayed everyone and my life with that sexy flawless epic performance
0,20120528005943Z,i love serendipity frozen haute chocolate
0,20120618232602Z,you shit me not what that all about <SIGNS>
0,20120530134834Z,it the title that matters in this case
0,20120619235729Z,yes they are and ireland is the richest
0,20120610081049Z,dear lord i believe you are guiding me to find my destiny there may be lost there may be obstacles there may be faliures there may be disappointments yet i never give up my fight for a wiser way of life may you be always with us and guide us away from getting lost
0,20120619194931Z,obama is working as fast as he can
0,20120529202535Z,easy to tell when it the off season n nubbs should put a crossword puzzle on the blog
1,20120610193549Z,you are an idiot why do you even bother <SIGNS> wasted words
0,,and rape and incest xc xa that self control too <SIGNS>
0,20120610040020Z,my big homo lil wayne fucks this nigga in his ass when it comes to music
0,20120529211749Z,irony this has nothing to do with <SIGNS> you just ca not take off your rosecolored glasses long enough to see that there is a real problem a dodger stadium <SIGNS> they need to tear that dump down and relocate
0,,is that why your head smells like obamas ass <SIGNS>
0,20120620005935Z,exactly xa mccain is not sexist xa he is also responsible for that complete fucking imbecile joe the plumber
0,20120530144654Z,that the difference they ca not just make a run and think they can win against the spur they have to be able to make stops when it counts young team bright future
1,,lol <SIGNS> do you even realize you are making a fool of yourself i bet next you will post something like i forwarded your post to the fbi or maybe i told my mommy speaking of growing up get busy xc xa
0,20120609235117Z,this is getting very silly headline my race hell a tad dramatic
0,20120530040622Z,aw you go back checking your posts for likes how sad
1,20120612130916Z,you stupid f u c xa xa k i hope you die the same way she did
1,20120620162014Z,but you could not show any proof of that even if it was true ngo away you are an embarassment to your klan brothers your family your neighbors your teachers and america as a whole nfind something to say that is not directly quoting nazi or stalinist propaganda nthe most pathetic poster on the web you are below oberbite a soros trool or the ignorant little heap that wwrote waiting to exhale
0,20120620134646Z,many ppl report seeing an officer pounding away at his chest while screaming breathe you mofo
0,,iv installed but siri just says unable to help please try later <SIGNS>
0,20120610042435Z,yes they are hope you are feeling better time heals everything no matter how many folks say this to you and no matter how much you think your life is over it not and it will hugs
0,,for those of you who do not know this check out the dep of ag xc xa the food stamp program comes out of the dep of ag budget for those of us who are farmers we would like that explained to all and we would also like the us government to get out of our business with their cheap food policy the regulations and demands made on farmers by the usda epa irs nsc etc would blow your minds xc xa and don t forget peta <SIGNS> enjoy every bite of food that you take unless of course it is not grown in this country farmers in other parts of the world do not have to abide by the same rules we do i have no problem cutting the budget any business that wants to stay in operation has to be lean to prosper
0,,famousoriginallucas nobjustryan il have to pack my things and go dont my me i have been working on my ray charles chops
0,20120527185956Z,being a natural born citizen is not based on the nationality of your parents
0,20120529083811Z,i come to discover that actually know the name of an official can mean nothing good
0,20120530074948Z,michael jordan won his first title after seven years lebron is in his ninth season
1,20120620073123Z,all these news are planted and for getting some extra media attention that all bloody fucker ranbir fucker kapoor
1,20120612115443Z,are you fucking dumb making it clear that the group was delaying their comeback due to album production and not to xa avoid competition with other groups xa you should be thankful that ne did not cameback this june if ne did those awards will be owned by ne xa fuckin insicured fx fan
0,20120610051138Z,wtf is this shit <SIGNS> he shot the fuck out for this shit diz won and i only seen this clip of the battle smh
0,20120611171212Z,obama econimic plan bs <SIGNS>
1,20120320161748Z,you are an idiot <SIGNS>
0,20120620001218Z,how is it reasonable anon when harper has done none of the things you attribute to fascism all powerful leader has to stand for re election in three years strict social order you joking right glorification of militarism the troops have been recalled and their budget trimmed opposition parties hale and hearty and full of piss and vinegar elimination of organized labour no they did that to themselves by pricing themselves out of the market advancement of business over individuals elaborate ethno centrism try qu xe bec thomas mulcair home ground disparagement of the constitution that the scc specialty belittling the courts who does not these days and for good reason dissolution of mp power do you see the house of commons burning along with those crosses in prince george spying on ordinary citizens child pornographers are not ordinary citizens n njudging by the raving of harper enemies on these blogs if he wins another majority there going to be a worldwide tinfoil shortage
1,20120611025055Z,well i was born and raised in africa and proud of it <SIGNS> wth do you think africans are lesser than you or something <SIGNS> take your ignorant ass somewhere else cuz i not the one
0,20120610023625Z,see i was actually reading your comment until i got to the comment but i completely backed herman cain before he backed out because of the scandal then i realized you know nothing about politics do some research then come back and make an educated comment
0,20120610003130Z,so you think cigar willie clinton will help obongo win balack obongo nhas learned his lesson too late you cant trust a fuckingliberal just nlike you cant trust a liberal troll commenter
0,20120528233639Z,i never liked interleague play but they did not ask me lol
1,20120620111856Z,and odumbo is an old lying inept loser communist ni er what your point <SIGNS>
0,20120515185619Z,mom looks like an ol ho from way back herself screw her and her pervert a son
0,20120610114910Z,when you could not reveal the names given of foreign a c holders you are nothing but an another piece of crap like pm chidu deshmukh salman etc you all lost the confidence of public because of lies after lies history will never forgive you guys
0,20120609210546Z,when that nigga tighten his belt i knew he couldnt fucked up xa he look like wanda
0,20120612095155Z,viva mi odpisa u a u ce klip b u dzie emitowany jak tylko otrzymaj u emisyjny teledysk
0,20120620175609Z,that what the full comment banner at the top is for but you are right the front page links to opinion pieces without indicating them as such
0,20120530030207Z,are you rooting for nole now <SIGNS>
0,20120611041254Z,ahr xa xa http t co ntz lk h bama http bit ly ldqwwy http t co lywpopfj in http t co lbphn o o http shar es qngko http shar es qplm inherit http shar es qmm k http shar es qmnpx the http t co yqdpnkvm http shar es qnx h wind http t co bsxx whh http t co oj w oae bama http shar es qveog http t co r ha h in http t co hhgn i r o http t co c kmuftr http t co g vxfi r http paper li f they d abs lutely n thing http bit ly mrzlgv http shar es qiai delusi nal http bit ly mrzlgv http t co yhelahaq http shar es qzcvl angry http bit ly mrzlgv http t co ic kvhem selfish http bit ly mrzlgv http shar es qzt k http shar es qzmxa lying http bit ly mrzlgv http shar es qzcvl http shar es qzst stingy http bit ly mrzlgv http shar es qi em c rrupt http bit ly mrzlgv http shar es qztz greedy http bit ly mrzlgv http shar es qkujt http shar es qz im crooked http bit ly mrzlgv http shar es qztz http shar es qcygh c mmunist http bit ly mrzlgv http shar es qztvq http shar es q ubh republicans ufeff ufeffhttp bit ly mrzlgv http shar es qiai http t co t tg pf all have committed ufeff p litical suicide ufeff o http shar es qkujt the unre electable bigtime ufeff lazy whiningass crybaby pathetic http t co yhelahaq loser http t co yxvuisfr demon j hnhttp bit ly mrzlgv the http t co v lfbeyg pacifier sucka b ehner http t co srguvysy damn rite http shar es q dfn lugar is definitely out http shar es qzlij you next the unm tivated unre electable ufeff well kn wn super dastardly weakminded http t co yhelahaq s rryass quitter loser http t co yxvuisfr demon eric http bit ly mrzlgv ufeff the cowardly http shar es qm b http t co v lfbeyg weasel cant r http t co srguvysy damn rite http shar es q dfn lugar is definitely out http shar es qzlij you next http t co rxnmrt the ld ufeffhttp t co xgn fpb dumbass loser http t co yhelahaq demon its definitely ufeff time retire http t co yxvuisfr mitch http bit ly mrzlgv the bigg http t co v lfbeyg time evil snitch http shar es qi ly mcc nnell http t co srguvysy damn rite http shar es q ubh lugar is definitely out http shar es qzlij you next inherit http goo gl oi s the http t co immdufcc wind ufeff you are ufeff most definitely ufeff g ing http shar es qbkpn b w d wn http shar es q ubh believe http shar es q dfn y ur bstructionism http shar es qkujt d abs lutely n thing http bit ly mrzlgv final days ar ufeffe most definitely numbered http t co t tg pf it is permanently engraved in st ne http bit ly mrzlgv damn rite http t co k wu w president obama http t co lis macd a man f all the pe ple in o http t co immdufcc forward give moe powwa da peeps
0,20120620154635Z,the great problem with trying to make yourself stupider than you are is that you often succeed from the magician nephew if memory serves
0,20120515170815Z,i guess you are those who have a fetish for huge silicon boobs
