Insult,Date,Comment
0,20120609203600Z,bitch you gonna get hit meow
0,,henry cisneros democrat u s secretary of housing and urban development from to pleaded guilty to a misdemeanor charge of lying to the fbi james a traficant jr democrat member of house of representatives from ohio expelled from congress after being convicted of corruption charges sentenced today to eight years in prison for accepting bribes and kickbacks john doug hays democrat member of kentucky state senate from to found guilty of mail fraud for submitting false campaign reports stemming from an unsuccessful run for judge he was sentenced to six months in prison to be followed by six months of home confinement and three years of probation xc xa xc xa henry j cianfrani democrat pennsylvania state senate from to convicted on federal charges of racketeering and mail fraud for padding his senate payroll sentenced to five years in federal prison david hall democrat governor of oklahoma from to indicted on extortion and conspiracy charges convicted and sentenced to three years in prison john a celona democrat a former state senator was charged with the three counts of mail fraud federal prosecutors accused him of defrauding the state and collecting hundreds of thousands of dollars from cvs corp and others while serving in the legislature celona has agreed to plead guilty to taking money from the cvs pharmacy chain and other companies that had interest in legislation under the deal celona agreed to cooperate with investigators he faces up to five years in federal prison on each of the three counts and a fine xc xa allan turner howe democrat u s representative from utah from to arrested for soliciting a policewoman posing as a p rostitute jerry cosentino democrat illinois state treasurer pleaded guilty to bank fraud fined and sentenced to nine months home confinement joseph waggonner jr democrat u s representative from louisiana from to arrested in washington d c for soliciting a policewoman posing as a p rostitute n nlafayette thomas democrat candidate for tennessee state house of representatives in sheriff of davidson county from to indicted in federal court on counts of abusing his power as sheriff pleaded guilty to theft and mail fraud sentenced to five years in prison mary rose oakar democrat u s representative from ohio from to pleaded guilty to two misdemeanor charges of funneling through fake donors david giles democrat candidate for u s representative from washington in and convicted in june of child r ape gary siplin democrat state senator florida found guilty of third degree grand theft of or more a felony and using services of employees for his candidacy edward mezvinsky democrat u s representative from iowa from to indicted on federal fraud charges xc xa lena swanson democrat member of washington state senate in pleaded guilty to charges of soliciting unlawful payments from veterans and former prisoners of war abraham j hirschfeld democrat candidate in democratic primary for u s senator from new york in and offered paula jones million to drop her s exual harassment lawsuit against president bill clinton convicted in of trying to hire a hit man to k ill his business partner n nfrank thompson jr democrat u s representative from new jersey from to implicated in the abscam sting convicted on bribery and conspiracy charges sentenced to three years in prisonmichael joseph myers democrat u s representative from pennsylvania from to xc xa alcee lamar hastings democrat u s representative from florida impeached and removed from office as federal judge in over bribery charges xe x xa marion barry democrat mayor of washington d c from to and again from to convicted of cocaine possession after being caught on videotape smoking crack cocaine sentenced to six months in prison xe x xa mario biaggi democrat u s representative from new york from to indicted on federal charges that he had accepted bribes in return for influence on federal contracts convicted of obstructing justice and accepting illegal gratuities tried in on federal racketeering charges and convicted on felony counts xe x xa lee alexander democrat mayor of syracuse n y from to was indicted over a million kickback scandal pleaded guilty to racketeering and tax evasion charges served six years in prison xc xa bill campbell democrat mayor of atlanta indicted and charged with fraud over claims he accepted improper payments from contractors seeking city contracts xe x xa frank ballance democrat congressman north carolina pleaded guilty to one charge of conspiracy to commit mail fraud and money laundering related to mishandling of money by his charitable foundation hazel o leary democrat secretary of energy during the clinton administration o leary took trips all over the world as secretary with as many staff members and at times rented a plane which was used by madonna during her concert tours n ndan walker democrat governor of illinois from to served less than two years of a seven year sentence for receiving improper loans a decade after leaving office gerry eastman studds democrat u s representative from massachusetts from to the first openly g ay member of congress censured by the house of representatives for having s exual relations with a teenage house page hiram monserrate queens city councilman and state senator elect who has claimed to be an advocate of victims of domestic violence was arrested for breaking a glass over his girlfriend face monserrate a former cop won election to the state senate as a democrat in november james c green democrat north carolina state house of representatives from to charged with accepting a bribe from an undercover fbi agent but was acquitted convicted of tax evasion in xc xa frederick richmond democrat u s representative from new york from to arrested in washington d c in for soliciting s ex from a minor and from an undercover police officer pleaded guilty to a misdemeanor also charged with tax evasion marijuana possession and improper payments to a federal employee pleaded guilty xc xa raymond lederer democrat u s representative from pennsylvania from to implicated in the abscam sting convicted of bribery and sentenced to three years in prison and fined harrison arlington williams jr democrat u s senator from new jersey from to implicated in the abscam sting allegedly accepted an interest in a titanium mine convicted of nine counts of bribery conspiracy receiving an unlawful gratuity conflict of interest and interstate travel in aid of racketeering sentenced to three years in prison and fined ndaniel david rostenkowski democrat u s representative from illinois from to indicted on felony charges pleaded guilty to two counts of misuse of public funds and sentenced to seventeen months in federal prison melvin jay reynolds democrat u s representative from illinois from to convicted on sexual misconduct and obstruction of justice charges and sentenced to five years in prison wayne bryant democrat nj state senator was convicted was found guilty on all counts against him including bribery and pension fraud charles coles diggs jr democrat u s representative from michigan from to convicted on eleven counts of mail fraud and filing false payroll forms sentenced to three years in prison george rogers democrat massachusetts state house of representatives from to m ember of massachusetts state senate from to convicted of bribery in and sentenced to two years in prison don siegelman democrat governor alabama indicted in a bid rigging scheme involving a maternity care program the charges accused siegelman and his former chief of staff of helping tuscaloosa physician phillip bobo rig bids siegelman was accused of moving from the state education budget to the state fire college in tuscaloosa so bobo could use the money to pay off a competitor for a state contract for maternity care john murtha jr democrat u s representative from pennsylvania implicated in the abscam sting in which fbi agents impersonating a rab businessmen offered bribes to political figures murtha was cited as an unindicted co conspirator otto kerner democrat governor of illinois from to was jailed after the manager of two horse racing tracks admitted to bribing the then governor charges were filed after kerner left office he was convicted in nbarney frank democrat u s representative from massachusetts from to present admitted to having paid stephen l gobie a male p rostitute for s ex and subsequently hiring gobie as his personal assistant gobie used the congressman washington apartment for p rostitution a move to expel frank from the house of representatives failed and a motion to censure him failed under a democratic majority dnc the federal election commission imposed in fines against participants in the democratic party fundraising scandals involving contributions from china korea and other foreign sources the federal election commission said it decided to drop cases against contributors of more than million in illegal dnc contributions because the respondents left the country or the corporations are defunct sandy berger democrat national security advisor during the clinton administration berger fined for illegally removing highly classified documents and handwritten notes from the national archives during preparations for the sept commission hearings xc xa robert torricelli democrat withdrew from the senate race with less than days before the election because of controversy over personal gifts he took from a major campaign donor and questions about campaign donations from james mcgreevey democrat new jersey governor admitted to having a gay affair resigned after allegations of sexual harassment rumors of being blackmailed on top of fundraising investigations and indictments jesse jackson democrat democratic candidate for president admitted to having an extramarital affair and fathering a illegitimate child gary condit democrat us democratic congressman from california condit had an affair with an intern condit covered up the affair and lied to police after she went missing no charges were ever filed against condit her remains were discovered in a washington dc park xc xa eliot spitzer democrat new york governor resigned from office after being tied to a p rostitution ring sowande ajumoke omokunde democrat the son of newly elected u s rep gwen moore was booked on charges of criminal damage to property for allegedly slashing tires on vans and cars rented by the republican party for use in election day voter turnout efforts n nanthony weiner democrat takes pictures of his p enis and t weets it to under age teen and six other women while his wife is carrying his child his p enis ends up on the internet for all of time and resigns from office john edwards democrat extramarital affair admitted to in august by john edwards a former united states senator from north carolina and democratic party presidential candidate the affair was initially reported by the national enquirer an american supermarket tabloid newspaper but was given little or no coverage by many sources in the american mainstream media the enquirer cited claims by an anonymous source that edwards had engaged in the affair with rielle hunter a filmmaker hired to work for his presidential campaign and that the relationship had produced a child durin the time when his wife made a announcement that her cancer had returned and was found to be incurable elizabeth died on december xc xa maxine waters xc xa democrat as a congressional ethics panel prepares to try maxine waters for steering federal funds to her husband xe x x s failing bank a newspaper reports that the veteran california lawmaker is embroiled in a separate corruption scandal involving her beloved hubby xe x xa xe x xa xe x xa xe x xa citing federal records the story says that a powerful lobbyist paid waters xe x x banker husband sidney williams in xe x x cconsulting fees xe x x d as she co sponsored a law aimed at saving a business that was among the lobbyist xe x x s top clients the internal revenue service irs had determined that the real estate finance firm and others like it were xe x x cscams xe x x d and the congresswoman xe x x s measure would have overturned a federal ban that would have allowed the shady enterprises to keep raking in lucrative profits for years the firms acted as a middleman to help sellers finance down payments so that low income buyers could qualify for mortgages insured by the federal housing administration fha the lobbyist who paid waters xe x x husband represented the nation xe x x s largest such middleman sacrament based nehemiah corp which stood to lose hundreds of millions of dollars if the ban wasn xe x x t reversed by friendly lawmakers like waters implemented in the federal ban was never overturned but not for lack of effort on waters xe x x part the ten term congresswoman sponsored legislation three times to stop the ban or repeal it once it became law she claims she did it because the program allowed hundreds of thousands of low income families to become homeowners news of this latest scandal comes as the house ethics committee prepares to try waters for using her influence to steer million in federal bailout funds to a failing bank that subsequently got shut down by the government in which she and her board member husband held shares a few months ago the congresswoman got in trouble again for skirting federal elections rules with a crooked fundraising gimmick that allows her to receive unlimited amounts of donations from certain contributors instead of raising most of her campaign funds from individuals and political action committees waters sells her endorsement to other politicians and political causes for as much as a pop allowing her to rake in hundreds of thousands of dollars in short periods of time neil goldschmidt xe x x democrat xe x x oregon governor admitted to having an illegal sexual relationship with a year old teenager while he was serving as mayor of portland xc xa xc xa william jefferson clinton democrat xc xa impeached by the house of representatives over allegations of perjury and obstruction of justice but acquitted by the senate after a s ex a scandal with an intern edward moore kennedy democrat u s senator from massachusetts pleaded guilty to leaving the scene of an accident after his car plunged off a bridge on chappaquiddick island killing passenger mary jo kopechne n
0,20120619031758Z,i liked your comment not because it was sensible but because it was so far ny
0,,blazeraddict blaine jungwirth afrika bambaataa yeah i got the same gift
0,20120528165031Z,is it night time where you live <SIGNS>
0,,why do not schools worry about teaching instead of dumbs t for real are not our childrens educations suffering enough with every hippie retard in the world making it worse you freaks and you dainty feelings whining cause your parents whipped your little bad ass when u deserved it are screwing the whole thing up
0,20120611182846Z,more than half of living medal of honor recipients have endorsed romney
0,20120530140333Z,no list is complete without peach city in brigham city now that is a burger joint <SIGNS> also how did hometown drive in make the list in laketown but not labeau labeau put the r in raspberry shakes
1,20120320122805Z,get thatdick outta your mouth so you can talk
0,20120620050741Z,i hope you are not setting the standard by using your real name on gc posts
0,20120530134541Z,conference champs only we are not trying to pick the pecking order but give every school via their conference a path to play for the national championship n nthis is so simple to get right why do these clowns keep screwing it up <SIGNS> n nwin your conference you play lose you do not
0,20120619031424Z,corporations are people n ngoogle corporate citizenship n n however many also take it to mean that corporations should be regarded as citizens within a territory i e that corporations have citizenship of some sort this is usually based on the principle of corporate personhood in that in certain legal jurisdictions such as the united states companies are afforded some of the same legal rights as individuals
1,20120320092850Z,you did not read the article and you are a ignorant putz
0,20120527175812Z,you are lucky to have any privileges at all after saying some of the most vile comments in the history of this blog
1,20120619134950Z,are you really this stupid <SIGNS>
0,20120502171157Z,pitbulls are not banned in broward county put one inside your bussiness and wait for the stupid maggot to be pleseantly surprised by fido
0,20120529233614Z,ya and feed him more chocolate
0,20120619145029Z,cde cb f c da eb disqus gunjan di plz mujh se naaraz mat ho you are angry coz i thought to close my ff di maybe people do not like it aur uss larki ne bhi kuch soch samajh kar hi comment kia hoga that my ff is not good ab plz mujh se gussa mat ho n n ae ceb fc ba da fcea disqus sadaf di aap bhi mujh se gussa ho plz aap tou gussa mat ho actually di meri koi id nahi hai aur na hi mein fb per hun mein tou comment bhi apni behen ki id se karti hun i do not have an id aur waise aap ka chat box wala idea bura nahi hai
1,20120612021335Z,stfu your existence offends me
1,20120619000948Z,it much better than the left wingnuts who got us into this mess in the first place <SIGNS> xa like you susan <SIGNS>
0,20120619010605Z,you lack empathy is a fucking great drink <SIGNS>
0,20120612024611Z,just because owebama came out of the closet does not mean you should all blindly follow suit
0,20120610144005Z,hm new ios without new hardware to try on so far iphone announcements have been done at wwdc in the past numerous times already unless new ipod touch pops out of no where to demo it and bring siri to ipad <SIGNS> will see tomorrow how it plays out
0,20120530025331Z,i agree it is hard which is why i try to stay away from it because there is no way to really know who would be better
0,20120503011021Z,yep you are officially addicted to polyvore as am i <SIGNS> p
0,20120609213709Z,amazing eh talk about gaining experience and considering last year in college he probably only played games pretty incredible
1,20120320183157Z,hoss xa xa jenbroflovski xa fuck you you old fuck the real john mclain n xa nthe real one from die hard
0,,o neil is the best manager in the world fact love to see jose do what mart does no chance
0,20120619183457Z,wa <SIGNS> wa <SIGNS> n n nlisten to those libturds whine <SIGNS> xa xa they know they are toast so they xa yap and snip like xa little chihauhaus <SIGNS> n n no offense to chihauhaus intended
0,,and we could put up a high stakes russian xc xa roulette xc xa game i sure a few people would choose to do that too like young girls choose prostitution people choose to be crack heads the fact that you can blow the rent money on the roll of the dice and leave your children homeless is case in point
0,20120527194002Z,we need to have a honest goverment and clean up all communists from any party now
0,20120530040433Z,because kagawa is not going to sell shirts to their favourite team
0,20120612050542Z,waiting to hear them say black huh <SIGNS> black <SIGNS> okay now unhand yourself go and smoke a cigarette better is not it you relly should invest in hustler or playboy
0,,well he wants to ban gay marriage even in states where it is currently legal he wants to ban adoption for gay couples he thinks planned parenthood has a hidden agenda and xc xa he wants xc xa nno abortions even in cases of rape
0,20120611195944Z,there is a good team on the field idiot <SIGNS> people get injured people slump <SIGNS> to say gonzi and youk are no better at hitting than the fans is absolutely ridiculous and upsurd <SIGNS> do rsn and the red sox a favor and stay at home and shut the f ck up <SIGNS> you are a prime example of what i am talking about <SIGNS> if you going to criticize then do it realisticly and stop pulling dumb sh <SIGNS> t out of your a <SIGNS> as for the rabbits foot i not talking about luck here i am talking about a behavoir of the fans that is bleeding into the club house you try and perform while constantly criticized and have to endure stupid comments like you i not saying it is the main problem but it certainly does not help anyone <SIGNS>
1,20120320152302Z,you really are a complete moron yo must be one of those incompetent welfare leeches who does nothing but put a drain on every hard working person in this country cut the cord do something with your pathetic life
0,20120612114628Z,really <SIGNS> nsince when has it become cool to defend him <SIGNS>
1,20120609211608Z,nope it is a moron like you who needs to shut up
1,20120612003605Z,you are simply comically idiotic xa or you just a depressing fool xa either way you still just a liar and an internet coward xa cheers <SIGNS>
0,20120610140500Z,cause you never know when you gonna need one lol o
0,20120529051554Z,you are not better than your bedtime
1,20120515214325Z,you are wrong idiot <SIGNS>
0,20120619235643Z,something tells me he is a burglar at night
0,20120528001652Z,president romney xa sounds really good now cheney for vp and we all set xa yeah that the ticket romney cheney xa and the xa motto will be xa just to piss off the liberals
0,20120529211613Z,of course iran has been talking us to death for years in their development of nukes xa with obama and hillary they have willing allies to prolong it even further xa the israelis and believe or not the saudi and jordanians will not wait for obama knowing exactly who he supports xa the arabs have as much to lose because occupying them is also on irans time table xa simply put the iranians are shiite and the saudi and jordanians are sunni they hate each other deeply xa in this case enemy of my enemy is my friend at least for today
0,20120529233723Z,getting your face ate off
1,,do not you get tennis elbow from jacking off as much as you do
0,20120610160701Z,nigga didnt even pinch the bitch he a cowered tho deserved that ass whooping
0,20120611190127Z,a frank yesterday a frank today a frank tomorrow i have been and always will be one big frank
0,20120619161616Z,tstev you really ought to get a life you accused me of being another commenter pretending to be a supporter of that commenter stance in another article long ago you post more than anyone i have ever seen and your posts are always vicious petty and pointless and quick to whip out ad hominem attacks you post so often that i wonder how do you pray tell make a living are you one of the do you live in your parents basement i sure you ll accuse me of being yet another abigail or something idiotic along those lines by all means deflect away from legitimate discussion that the height of maturity
0,20120618201729Z,what muslims are currently being line up for hate <SIGNS>
0,,i feel bad for the woman what would have made this story better is if the man attempted to rape her and she pulled a mm and gave that guy a dirt nap but who needs guns guns are barbaric and rapes murders and home invasions only happen in the movies and on tv n ninstead this guy is gonna be in jail and all the liberals will think he is gonna be rehabilitated and he will become a contributing member of society on release xc xa n nsuch a waste of tax dollars
1,,bitch be quiet somebody needs to kick your ass for talkin that stupid shit hoe
1,20120609204523Z,you are a complete moron
0,20120611191705Z,android is everything steve jobs envisioned ios to be that why he hated it so much lmfao that was apples most pathetic update yet that shit should not os
0,20120527164037Z,thats ok if i get in trouble there will be millions worse off i ll loot with the best of em
0,20120609195443Z,the boys at epic mealtime must be proud
0,20120529124855Z,i like season ok it was not as good as the later half of season first half of season but it was not terrible or even merely bad
0,,shola what planet do you live on you need to get down to specsavers blind or stupid <SIGNS>
0,20120529035751Z,illegal cuban zombies castro revenge for sega genesis only from akklaim
0,,i believe in the mantra no risk no fun however n non balance i would have to fall in line with the do not do it camp on this one having said all that there is an old snap of self on a dirt bike laying around somewhere with my young daughter clinging to me on pillion seat having fun but neither of us wearing crash hats n ni guess we all have rash moments
1,20120612124952Z,you piece of scum according to the sa constitution this lady was a black person hope your mother is the mother of all old cows idiot
0,,arsene wenger is a great manager of that there is no doubt and i for the life of me could not understand that substitution however he is the manager not me and he may have had a sensible reason for doing it we do not know
0,20120612151535Z,i feel like shotime looked inside my dreams and just picked a bunch of random shit out of it to make a show sheen caplan sex period pieces retro science and sex
0,20120619014740Z,shearnut that you may be correct i do not like people who want to destroy america
0,,what an honor to be able to see you so up close and personal i will be counting the sleeps if i had a tail i would wag it
0,20120620023823Z,truthincaps for you to understand xa just a second doctor a patient for you in gaza
0,20120528000552Z,any chance they served deep fried anything on a stick at this event <SIGNS>
0,20120529022715Z,lots of fouls lots of free throws made comin up <SIGNS>
0,20120609205825Z,i will fuck the shit outta of judge judy have her hollering order order order
0,,xc xa if you take out the fags and booze and such like leaving say xc xa xc xa per week say and then recognise that they are feeding people then that does not seem too extreme xc xa or so per day per person n ni no sympathy though because they should be spending their money more wisely given their circumstances
0,20120612051716Z,fuck toygers i want a mutini
